Timestamp,Email,Upload a passport photograph,Title,Customer first name,Customer last name (surname),Customer middle name,Gender,Date of birth,Client's residential address,Client's email address,Marital Status,"Client's phone number
(Whatsapp line)",Occupation,"NIN 
(This data is strictly utilized for our Know-Your-Customer (KYC) verification, in accordance with the requirements of the Nigerian government.)

NIN Lookup: Use the phone number linked to your NIN registration and:

Dial *346#.

Select '1' for ""NIN Retrieval"" from the service options.

Complete the process by following the on-screen instructions and providing the requested information.",International Passport No/NIN Number,Upload NIN/International Passport ,Nationality,Property name,Next of kin's full name,Next of kin phone number,Next of kin's email address,Next of kin's occupation,Relationship,Next of kin's home address,Ownership Type,"Full name of the Second Owner
(Surname, First name, Other Name)",Email address (Co-owner),Upload Signature,Plot size,Payment Duration,Deposit Made (In Naira),Date of Payment/Deposit ,Upload receipt of payment/deposit,"Outstanding Payment, if any (in Naira). Input 'N/A' if payment is outright. ",Source of Income,How did you get to know about our property,"By checking this box, I confirm that I have read, understand, and consent to all of the following Land Republic documents: Terms and Conditions, Payment Protection Promise, and Resale and Refund Policies. I accept full responsibility for all legal implications and interpretations of this agreement. I understand that this subscription form becomes binding on all parties immediately upon the company's receipt of my payment.  ",Sales Rep / Marketer Name  ,Sales Rep / Marketer Name,Sales Rep Phone Number,City,State,Column 41
12/18/2025 15:58:33,Oscarmaxwell05@gmail.com,https://drive.google.com/open?id=1835U80hGrq5nzPOil6JY42K1MERxwPg0,Mr.,Maxwell,Osakwe,Uche ,Male,2/5/2000,"Ogwashi-uku, Delta state.",Oscarmaxwell05@gmail.com,Single,+258864231961,Business man,74424328526,A12087121,,Nigerian,Prime Circle Estate,Osakwe David Chidi,+234 808 679 7438,Davidchidi508@gmail.com ,Student,Sibling,"Ogwashi-uku, Delta state. ",I am the sole owner of this property,Osakwe Maxwell Uche,"Ogwashi-uku, Delta state. ",https://drive.google.com/open?id=1MJ0LVcN3NL5yr-bf6bXGDDUl7964Ye55,500 SQM,6 months,,,,,Business Income,Referral,I Confirm and Agree,,,,,,
12/29/2025 7:00:57,doncharles376@gmail.com,https://drive.google.com/open?id=1YowKAUzc5W216GfsAuecyFIpILRCuR2p,Master,Charles,Mbaogu,Chiakpaoke ,Male,3/9/2002,Block 33K Lekki Pride 1.0 Estate Lekki Ajah Lagos State,doncharles376@gmail.com,Single,07066944984,Software Engineer ,10515573269,,,Nigerian ,Coinfield Estate,Mbaogu Martins Ewezugachi,+2348165288460,,Student,Sibling,"No 3 Chief Boniface Avenue Izuoma Asa New Layout, Oyigbo Rivers State",I am the sole owner of this property,Mbaogu Charles Chiakpaoke ,doncharles376@gmail.com,https://drive.google.com/open?id=1pys3NdNzvKk9L9HnBEtAueFoEbQz2SwL,1000 SQM,6 months,,,,,Business Income,Salesperson,I Confirm and Agree,,,,,,
12/31/2025 18:04:33,mbaogudona@gmail.com,https://drive.google.com/open?id=1tHxGTTSB0XUJ_xcSdM91e8B1w4_tMDUX,Mr.,Donatus,Mbaogu,Okechukwu,Male,6/4/1957,"No 3 Chief Boniface Avenue Izuoma Asa, Oyigbo Rivers State",mbaogudona@gmail.com,Married,08035083789,Engineer ,40507294211,,,Nigerian,Coinfield Estate,Mbaogu Donatus Mgboatuchi,08132252759,atuchimbaogu@gmail.com,Mechanical Engineer,Child,Plot 10 WTC Estate Enugu,I am the sole owner of this property,Mbaogu Donatus Okechukwu,mbaogudona@gmail.com ,https://drive.google.com/open?id=1Mn8lxYhsY1jiUUuewOobPlGxjlAL1YX_,500 SQM,6 months,,,,,Personal Income,Other,I Confirm and Agree,,,,,,
3/18/2026 17:37:10,oluwadamilolaadigun2580@gmail.com,https://drive.google.com/open?id=112q_AcSCY5Sd_GZR4Wl3aXajEH65T78r,Mr.,Damilola ,Adigun,David,Male,6/10/1998,"12 Dele Oladipo Street Moniya, Ibadan.",oluwadamilolaadigun2580@gmail.com,Single,09153031939,Consultant ,45656298654,45656298654,https://drive.google.com/open?id=14Ep2rvbSBtge_2KEcNT5d8dP81KxIwew,Nigerian,Eid/Easter Special landsale 300sqm with 200k deposit.,Kehinde Peter Damilare ,07033221004,e032312.kehinde@dlc.ui.edu.ng,Librarian ,Sibling,"No 12 dele Oladipo street, agotapa Moniya Ibadan ",I am the sole owner of this property,No name,No email,https://drive.google.com/open?id=1Sei-tHgFFWRwe44_pOK2CINOWKey8zRR,300 SQM,3 months,"200,000",3/18/2026,https://drive.google.com/open?id=1D7kFv_IEZN2EHxIc-yfhG37Lw0bZs_0E,"450,000",Loan,Referral,I Confirm and Agree,,,,,,
3/23/2026 13:53:43,oluwavicky123@gmail.com,https://drive.google.com/open?id=1UjfRfxJJg2ryJSh0qUeE8C0MD8anbLJB,Miss,Oluwakorede,Agbede,Victoria ,Female,8/21/2001,"RD 3, Ocean palm Estate, Ogidan Sangotedo, Lagos ",oluwavicky123@gmail.com,Single,09032275958,Entrepreneur ,59426877825,59426877825,https://drive.google.com/open?id=1KmYgg5YPdYBMroZmy_MFZvjq01PDvkm0,Nigerian,Eid/Easter Special Land Sale,Agbede Oyinkansola Ebunoluwa,08142171004,,Student,Sibling,"Block 50, plot 28, Anjorin Estate off Ait, Alagbado Lagos ",I am the sole owner of this property,,,https://drive.google.com/open?id=1tHCE1VuXyUhQHfUcC3JeKLParnkkh4B_,300 SQM,Outright,"450,000",3/19/2026,https://drive.google.com/open?id=1st_9f-MdJ9sQWlOOhaNmONzzda9fJYuB,"50,000",Salaries & Allowance,Salesperson,I Confirm and Agree,,Mrs. Martha Ilebaye,0813 813 6366,Sangotedo ,Lagos state,
3/24/2026 14:43:56,Samuelloveth951@gmail.com,https://drive.google.com/open?id=1fd5DfFAu6qMtF96IxCm387gDMdz1ptEG,Mrs.,Loveth,Samuel,Ashimizo,Female,7/30/1994,"14, Moloney street, Ebutemetta, Lagos.",Samuelloveth951@gmail.com,Married,08038754969,Credit Control officer,13851529519,13851528149,https://drive.google.com/open?id=1Wr4t9FcQwhMf_FaCQc2s3-24GZ-6ZhAi,Nigerian,Eid/Easter Special Land Sale,George Aigbovioise Samuel,07033892182,Samueloise89@gmail.com,Facility manager,Spouse,"14, Moloney Street Ebutemetta, Lagos.",I want to add another name to the property (co-owner),George Aigbovioise Samuel,Samueloise89@gmail.com,https://drive.google.com/open?id=1bURwCwwKsEg9k9Wn44d1nedIMJSLFEAh,600 SQM,Outright,"#1,000,000",3/24/2026,https://drive.google.com/open?id=1WMTRNgJLdgBjGyoh96Gv3aggmlql8_g9,N/A,Salaries & Allowance,Salesperson,I Confirm and Agree,,Miracle Omole,08161115988,Lagos,Lagos,
3/24/2026 15:10:52,chkscaleb.ifeanyi@outlook.com,https://drive.google.com/open?id=1i_E7uLtfkY_pArK5p9xbAk1GyG0rIFj9,Mr.,Chuks ,Caleb,,Male,3/24/1982,Baybridge,chkscaleb.ifeanyi@outlook.com,Married,08109189477,Technician,102992033,19292033,https://drive.google.com/open?id=14FPfmvYfXB5l6yD6QBodLa3JTAt9gwDD,Nigeria,Eid/Easter Special Land Sale,Chuks ifeanyichukwu ,07938817728,,Forex,Spouse,Alakaiha,I am the sole owner of this property,,,https://drive.google.com/open?id=1FyVUbn3R2z-HZl8DoYzcICZTk0r7J8XA,300 SQM,Outright,500000,3/24/2026,https://drive.google.com/open?id=1FOajkd4HAzup34-kSC5lpMUg6kq25r4U,0,Business Income,Salesperson,I Confirm and Agree,,Samuel,,Yenagoa,Bayelsa,
3/24/2026 15:15:18,harosim2000@yahoo.com,https://drive.google.com/open?id=1KTHXEo9JePNRs46ZhUhnD_rYvlGUhZc3,Mr.,Semiu ,Arogundade,,Male,3/28/1988,47 Simpson street ebute metta Lagos ,harosim2000@gmail.com,Married,08020511981,Information Technology Engineer ,88046640857,88046640857,https://drive.google.com/open?id=1e8fxj8_hWwDYJJZHNCEQrS8xDVrfmKBp,Nigeria,"Mokoloki Mowe-Ofada, Ogun State ",Karimot Arogundade ,07086319366,,Business ,Spouse,Same as above ,I am the sole owner of this property,,,https://drive.google.com/open?id=1IXpoxpSAfMJZsGn2NXYxYMeRQHJBpUiM,600 SQM,Outright,"1,000,000",3/24/2026,https://drive.google.com/open?id=1gubysgXHpkprzFK3Y2krfSp5x6R4dGyx,N/A,Salaries & Allowance,Referral,I Confirm and Agree,,Miracle Omole,08161115988,Mainland ,Lagos ,
3/24/2026 15:37:39,atinukedehinbo@gmail.com,https://drive.google.com/open?id=1Y5fDKcrxdSCxusfIQc9ld9BdRz9-Join,Mrs.,Atinuke,Dehinbo ,Funmilayo ,Female,3/21/1992,1 Dele Laleye close Abule Oshorun Ikorodu Lagos ,atinukedehinbo@gmail.com,Married,09082582382,Marketing,25634645925,25634645925,https://drive.google.com/open?id=17STINRBdALMup_LyciWCgoug_P0uXWnu,Nigeria,Eid/Easter Special Land Sale,Daniel Bello ,08102624873,valiantkid24@gmail.com,Artisan,Spouse,1 DELE LALEYE CLOSE ABULE IBESHE,I am the sole owner of this property,,,https://drive.google.com/open?id=1wZrAEnKqLW8UVuJvljuv5wYYfW1iCJ91,300 SQM,3 months,"#200,000",3/24/2026,https://drive.google.com/open?id=18m4a0s7NZJeaUszJj1xIpBsaVqbpereS,"#450,000",Salaries & Allowance,Referral,I Confirm and Agree,,,,Lagos,Lagos,